"","score","text","klasifikasi"
"570",1,"if trump is doing such a wonders job why do coronavirususa figures show that he is not governors disagree with him as so do some medical e with integrity","Positif"
"571",0,"cutting through the fog part  of  covid coronavirus coronaviruspandemic coronavirususa covid censorship banned maga","Netral"
"572",0,"cutting through the fog part  of  covid coronavirus coronaviruspandemic coronavirususa covid censorship banned ale","Netral"
"573",0,"cutting through the fog part  of  covid coronavirus coronaviruspandemic coronavirususa covid","Netral"
"574",0,"cutting through the fog part  of  covid coronavirus coronaviruspandemic coronavirususa covid","Netral"
"575",1,"ppp loans sapped by big businesses  the daily social distancing show  via  covid coronavirus covidus coronaviruspandemic coronaviruslockdown coronavirususa coronavirusoutbreak","Positif"
"576",0,"quarantine hilarious diary quarantinediary covid coronavirususa","Netral"
"577",-3,"according to the us national archives  american soldiers died in the vietnam conflict which began in  and ended in   covid coronavirususa vietnamwar","Negatif"
"578",2,"can anyone in the us do a covid test on this poor young man both chinese amp american ppl need some answers from us govchinaliedpeopledied chinavirus coronavirususa trumpisanidiot trumpliesamericansdie chinazi","Positif"
"579",0,"cutting through the fog part  of  covid coronavirus coronaviruspandemic coronavirususa covid","Netral"
"580",7,"can you send me the report so i can read it over about what you say bebest and tell the truth coronavirususa","Positif"
"581",1,"i guess  has order his puppet  not to wear a mask  how irresponsible  this is not the way to handle this deadly coronavirususa covid  i hope he is going in quarantine now","Positif"
"582",0,"cutting through the fog part  of  covid coronavirus coronaviruspandemic coronavirususa covid","Netral"
"583",-1,"covid coronavirususa covid cases passes one million in usa","Negatif"
"584",0,"cutting through the fog part  of  covid coronavirus coronaviruspandemic coronavirususa covid","Netral"
"585",1,"god bless cuomo but when history is written and actions are measured charlie baker will be a serious subject  coronavirususa  coronavirus  lincolnproject republicans","Positif"
"586",-1,"yet again that you do not care about anything but your reelection and nothing about us now tell me why do you think anyone would vote for you after hearing you say things like that  maga kag coronavirususa covidusa gt","Negatif"
"587",0,"play this delighful quiz to beat your boredum    coronaboredom boredinthehouse usa lockdown coronavirus coronavirususa tweetme sharethis","Netral"
"588",0,"cutting through the fog part  of  covid coronavirus coronaviruspandemic coronavirususa","Netral"
"589",3,"i only know of one vicious griper  and sadly he can hack it as leader of the free world   narcissistinchief  coronavirus  coronavirususa","Positif"
"590",1,"unfortunately you are sooo factually incorrect  coronavirus  coronavirususa  narcissistinchief","Positif"
"591",-1,"these dead people trumpburialpits  trumpgenocide  trumpshitshow  covid  coronavirususa  vicepuppy     potusenemyofthepeople","Negatif"
"592",-2,"it just doesnt occur to them to count us  native americans are being left out of demographic data on covid impact in the us they are categorized under the label  in some states coronavirususa","Negatif"
"593",1,"trump ends briefing after reporter asks why reelect him after he lost mo  via  covid coronavirus covidus coronaviruspandemic coronaviruslockdown coronavirususa coronavirusoutbreak","Positif"
"594",-1,"last  days corono cases in usa  th apr  th apr  st apr   nd apr   rd apr    th apr   th apr   th apr   th apr   th apr   total   besafe coronaviruslockdown coronavirususa","Negatif"
"595",1,"find it watch it very informative  dr fauci definitely needs to do the coronavirus briefings to the country  coronavirususa","Positif"
"596",-1,"thanks from us secretary of state mike pompeo for the coronavirus covid aid sent by turkey coronavirususa","Negatif"
"597",0,"coronavirus trump orders meatpacking plants to stay open  coronavirususa usalockdown foodsupplychain warlaw","Netral"
"598",3,"how much of an closed minded paranoid asshole do you have to be to think maatje benassi bought the coronavirus and spread it around the us but not only is it that you begin to threaten her life including her husband coronavirus covid coronavirususa","Positif"
"599",0,"usa real data   prediction    today we surpassed  million confirmed cases with so many states set to reopen we are going to trend up  well at least all the states are telling people to wear masks now  covid coronavirususa","Netral"
"600",1,"you shld not mislead ur country and world one shld not look at number of tests but tests per million population and by that standard usa is not even close to other nations even uae is doing better than you coronavirususa","Positif"
"601",0,"fishing fishinglife angling anglers fishingcartoons cartoons cartoonart   ggone ccold fishturkey  coronaviruslockdownuk coronaviruslockdown coronavirususa  coronavirus","Netral"
"602",2," can you say karma what goes around comes around thesunkenplace hypocrites joke clowns coronavirus trumpvirus covid coronavirususa pandemic","Positif"
"603",0,"first us case of rare inflammatory syndrome linked to coronavirus  covid coronaviruspandemic coronavirususa","Netral"
"604",-3," feels like almost everyone is in need  meet s tina gonzales shes helping those hit hard by the covid outbreak with popup food pantries in san francisco coronavirususa nationalvolunteermonth","Negatif"
"605",-1,"fromthecenter us coronavirus death toll e americans killed in vietnam war as cases top  million  reporting by    vietnamwar coronavirususa","Negatif"
"606",0,"thread  coronavirususa coronavirusoutbreak covid covid covidpandemic","Netral"
"607",8,"let them go without your labor  let them go without the wealth you generate for them  let them go  they dont care about you so why should you care about them  labor dont need capital more than capital desperately needs labor  coronavirususa","Positif"
"608",0," this is a ct image of a patient with pneumonia from an article on ecigarette pneumonia in the united states on september   which will be used to further confirm the origin of covid virus fortdetrick covid coronavirususa ","Netral"
"609",1,"this is what real numbers are folks  poland polska pol european coronavirususa coronavirus flattenthecurve firefauci firebirx bigpharma covid covid coronavirushoax corona coronaviruspandemic fakepandemic","Positif"
"610",-1,"worldometer had k recover now its k wtf liars covid coronavirususa coronavirushoax fakepandemic","Negatif"
"611",0,"history repeats itself usa trumpgenocide coronavirususa","Netral"
"612",4,"i agree great article in support of you    kids optimism resilience happiness parentinginapandemic covid courageisbeautiful covid coronavirus coronavirususa health healthy drrachaelsilverman love motivation mentalhealth","Positif"
"613",-1,"us pug becomes first recorded dog to test positive for covid virus  coronaviruspandemic coronavirususa","Negatif"
"614",-1,"while the corruptgop went on vacation during this pandemic covid cases in us topped  million  coronavirususa republicansarekillingus firethegop prosecute lockthemallup","Negatif"
"615",6,"thank you  nurses docs and staff we love  you all thank you coronavirususa  firstresponders  nursescovid  nursesrock","Positif"
"616",-1,"while the corruptgop went on vacation during this pandemic covid cases in us topped  million  coronavirususa republicansarekillingus firethegop prosecute lockthemallup","Negatif"
"617",-1,"covid cases in us topped  million  coronavirususa republicansarekillingus firethegop prosecute lockthemallup","Negatif"
"618",-1,"while the corruptgop went on vacation during this pandemic covid cases in us topped  million  coronavirususa republicansarekillingus firethegop prosecute lockthemallup","Negatif"
"619",0,"i guess the house of representatives is not an essential service      houseofrepresentatives unitedstates  coronavirususa  covid  covid  covid","Netral"
"620",-1,"covid cases in us topped  million  coronavirususa republicansarekillingus firethegop prosecute lockthemallup","Negatif"
"621",0,"the mainstreammedia never talks about covid   remember that       coronavirususa ","Netral"
"622",-1,"while the corruptgop went on vacation during this pandemic covid cases in us topped  million  coronavirususa republicansarekillingus firethegop prosecute lockthemallup","Negatif"
"623",4,"speaker pelosi sen schumer gtgtgt congress looks foolish amp out of step with its inability to work amp vote remotely given coronavirususa given the technology available you really need to get these updates made","Positif"
"624",-1,"covid cases in us top  million  coronavirususa republicansarekillingus firethegop prosecute lockthemallup","Negatif"
"625",0,"fore coronavirususa","Netral"
"626",0,"the numbers are staggering it took about  years for the us to lose  americans in vietnam it took covid only  weeks to surpass that number coronavirususa","Netral"
"627",-1,"new york er doctor who treated coronavirususa patients dies by suicide coronawarrior rip","Negatif"
"628",0,"california governor says it will take months and not weeks before theaters can reopen in their state  coronavirususa","Netral"
"629",1,"gnotsafe g plandemic warzone  hospitals  filmyourhospitals  filmyourhospital  covid covid  covidusa  coronavirususa  coronaviruscolombia endthelockdown  endtheshutdown  firmetuhospital  coronavirusme lmao a could he just be playing a role lol actor","Positif"
"630",0,"nd wave  coronavirususa covid","Netral"
"631",-1,"or a span of  years  american deaths in the vietnamwar     or a span of appro  weeks   covid american deathsand counting coronavirususa coronavirus","Negatif"
"632",0,"with more than  deaths more americans have died with covid than died in the vietnam war coronavirus covid trumpsvietnam coronavirususa","Netral"
"633",0,"hey whacko coronavirususa deniers gtgt reported us coronavirus cases   weeks ago  cases  weeks ago  cases  weeks ago  cases  weeks ago  cases  weeks ago  cases  weeks ago  cases  weeks ago  cases right now  cases","Netral"
"634",1,"coronavirususa you are a fraud broadcasting fraud bullshit gopdeathcult california doctors with dubious covid conclusions debunked","Positif"
"635",0,"coronavirususa it is heartbreaking to see total cases in usa e  million today complete failure of the  administration in containing the spread","Netral"
"636",0,"shame  shame      trumpliespeopledie trumpfailedamerica coronavirususa donaldtrump  mayoclinicqanda trumppandemicfailure","Netral"
"637",2,"jets from the us navy  and the air force  fly over new york city to pay tribute to health workers fighting the coronavirus pandemic coronavirususa  via","Positif"
"638",0,"after  went in to mayo clinic they deleted it after about  mins in hospital something is truly fishy  cnn fakepandemic fakevirus covid coronavirususa coronavirushoax mikepence trump pence","Netral"
"639",0,"coronavirususa  the case for ending the covid pandemic with mass testing by one estimate america may need  million covid tests per day for people to return to work you can effectively fight the coronavirus pandemic without widespread testing to find out who has it","Netral"
"640",3,"when he doesnt test positive this going to be biggest fuck you to       you all gonna get the biggest middle finger to show you its not bad  covid covid coronavirususa coronavirusliar coronavirushoax hoax covidhoax fakevirus","Positif"
"641",1,"the us on tuesday became the first country in the world to have more than one million cases of coronavirus it accounts for nearly onethird of the  million cases globallycoronavirususa","Positif"
"642",3,"thank you and if you know someone who is still bringing up the flu  covid coronavirus coronavirususa coronaviruspandemic sarscov pandemic inthistogether sticktoscience","Positif"
"643",1,"does the white house or the potus have a statement to make about this  coronavirususa coronavirus covid","Positif"
"644",-1,"the rumor is no live theatre until january  at the earliest   covid coronaviruspandemic coronavirususa","Negatif"
"645",-2,"pence doesnt believe in science he amp trump need to get out of the way theyre putting all americans at risk    coronavirususa","Negatif"
"646",-4,"doctors looking at the numbers following the science drop bombshell on medical states   coronavirususa narrative doctors dan erickson and artin massihi operate several clinics concluding it no different than the flu  by  at the numbers","Negatif"
"647",-1,"just so everyone is aware hospitals are currently denying service animals in violation of the ada so if you have one dont plan on getting sound medical care coronavirususa","Negatif"
"648",-1,"look at the irony so called developed usa on its knees  all the military power tech advancement cant protect and simple and quick measures hv put vietnam much ahead coronavirus covid chinaliedpeopleadied makechinapay coronavirususa","Negatif"
"649",2,"just give it up amp let someone else drive                  trump amp pence  before you get us all killed        trumppressconference trumpliespeopledie   coronavirususa","Positif"
"650",-3,"my elderly parents watch this bs  k dead in  month is not deadly enough this elitist swanson heir better not convince them its safe to be out and about when it most assuredly is not coronavirususa  fakefo","Negatif"
"651",-1,"trumps intel briefing book repeatedly cited virus threat report  morn  via  covid coronavirus covidus coronaviruspandemic coronaviruslockdown coronavirususa coronavirusoutbreak","Negatif"
"652",0,"coronavirususa covid  dozens of coronavirus cases connected to us primary election voting","Netral"
"653",1,"new report raises the question of whether trump didn believe his intel  via  covid coronavirus covidus coronaviruspandemic coronaviruslockdown coronavirususa coronavirusoutbreak","Positif"
"654",6,"todays covid update  new cases  more than yesterday  new recoveries  more than yesterday  new deaths  from yesterday  more data here   covid coronavirususa covid coronavirus","Positif"
"655",-1,"lets see if this  with  and clorox would work for real  coronavirususa  cloro","Negatif"
"656",1,"more newme quarentine life coronavirususa covid","Positif"
"657",0,"sadly this is spot on irishtimes covid coronavirususa potus","Netral"
"658",0,"documents suggest coronavirus task force prioritized which labs got test  via  covid coronavirus covidus coronaviruspandemic coronaviruslockdown coronavirususa coronavirusoutbreak","Netral"
"659",2,"he doesn give a shit it all about him just like it is for     coronavirususa covid covid coronavirus","Positif"
"660",0,"so what do doctors say about this  truthe whatisthetruth  coronavirususa","Netral"
"661",-2,"ny gov andrew cuomo blasts republicans for coronavirus bail out comme  via  covid coronavirus covidus coronaviruspandemic coronaviruslockdown coronavirususa coronavirusoutbreak","Negatif"
"662",0," sleep during the coronavirususa","Netral"
"663",1,"first known us coronavirus victim suffered burst heart pathologist    via   coronavirususa","Positif"
"664",-1,"coronavirus coronavirususa ccpliedpeopledied ccpmustdie it is time to stop ccp not by one man but millions of chinese supressed by the ccp which did not care how many people die world affected by covid must stop the evil commie ccp","Negatif"
"665",1,"a mask covers the eyes  seriously  hes dumb as a rock   coronavirususa coronaviruspandemic votehimout votebluetoendthisnightmare wakeupamerica","Positif"
"666",1,"hmmmperhaps u should tour coronavirus infected meat packing plants tomorrow djtu know they r the ones u have an e order to reopennot caring about the american employee health nor their families trumptourofmeatpackingplants coronavirususa testingtestingtesting","Positif"
"667",2,"jets from the us navy  and the air force  fly over new york city to pay tribute to health workers fighting the coronavirus pandemic coronavirususa","Positif"
"668",-3,"youre right    trump  has pushed lack of concern for workers to cruelty toward workers   meatpacking plants must be required to put in coronavirususa safety measures before they open meat workers must be eligible for unemploymentbenefits","Negatif"
"669",-1,"trump sinks in polls claims disinfectant comments were sarcastic a closer look   via  donthecon trumplies factsmatter covid coronavirus covidus coronaviruspandemic coronaviruslockdown coronavirususa coronavirusoutbreak","Negatif"
"670",3,"youre the head of the coronavirususa taskforce and you gave stupidly ridiculous e why you shouldnt have to wear a mask as per their guidelines some leader you are   drfauci  magats americafirst","Positif"
"671",-1,"connecticut has surpassed georgia and te in total cases currently with  coronavirus covid coronavirususa","Negatif"
"672",0,"stop it don lemon   you cant keep pointing out the do as i say not as i do administration that essentially does nothing mikepence covidiots coronavirus coronavirususa trumpvirus wearamask mayoclinic pencedemic pencepandemic penceisanidiot","Netral"
"673",2,"coronavirus is highly contagious and much more deadly than the flu keep yacking your nonsense  i hope you get sued for spreading misinformation coronavirususa","Positif"
"674",-1,"coronavirususa gacdctesting in fultoncounty and dekalbcounty","Negatif"
"675",1,"first known us coronavirus victim suffered burst heart pathologist    via   coronavirususa","Positif"
"676",0,"the meatpacking plants must be required to institute s safety guidelines why are they optional now or americans wont eat their meat        coronavirususa meat meatplants","Netral"
"677",-1,"there is nothing safe about these states reopening in  weeks there will be a resurgent if this virus and even more people will die trumpfailedamerica coronavirususa bloodonhishandstrump complicitcorruptgop","Negatif"
"678",0,"more than  usa coronavirus coronavirususa deaths in  hours johnshopkinsuniversity tracker","Netral"
"679",0,"coronavirususa death toll now e that of vietnam war coronavirususa death toll now e that of vietnam war coronavirususa death toll now e that of vietnam war","Netral"
"680",0,"this is all getting so nucking futs if we could dial this shit back to say or  i am content with playing atari and navigating a vcr  retro coronavirususa adulting vcr wtf","Netral"
"681",0,"im done being polite about  criminal negligence that led to my fathers death     covid coronavirus coronavirususa trumpvirus","Netral"
"682",0,"btw covid usa death count today is over   over  in the world  nottheflubro coronavirususa coronaviruspandemic covid wearamask","Netral"
"683",0,"timothy  niv tuesdaymotivation  scripture  amblogging  christianblogs  coronavirususa  georgia  stayhome  thebachelorltyh","Netral"
"684",3,"contrary to what half the us population thinks or so it seems and no matter who the president is heshe was not going one to stop it fact no one was stopping it  it a virus not a military threat coronavirus coronavirususa covid","Positif"
"685",-2,"i had some e inspections in baltimore downtown was quite eerie at  am on a monday morning coronavirususa","Negatif"
"686",0,"this is     genocide republicansarekillingus  deathcult you have blood  on your hands covid coronavirususa coronavirusupdates","Netral"
"687",0,"yep  you get credit on this one the us hits the  million confirmed coronavirususa infections get outta the way let the governors create a national plan","Netral"
"688",1,"would you take a coronavirus vaccine   vaccine covid coronavirususa pharmaceuticals","Positif"
"689",-1,"until new  and  guidelines for meatpacking plants are mandatory the meatpackers should stay closed if they dont then americans should forego eating meat     coronavirususa covidiot","Negatif"
"690",-2,"going out to dinner meeting up for happy hour rela at my apartment pool here in socal covid coronavirususa   sucks","Negatif"
"691",-3,"the jackass of the day award goes to mike pence for not wearing a face mask at the mayo clinic when all other visitors and staff there were wearing masks covid coronavirususa coronavirus politics trump","Negatif"
"692",0,"vote now on  are you planning to stop shaking hands with others in the future   handshaking covid coronavirususa pandemic","Netral"
"693",4,"according to which criteria or parameters do you make such assumptions with respect you are not an epidemology  virologist   i ask factual questions and dont stir up conspiracy theories   billgates   covid covid coronavirususa corona","Positif"
"694",3,"nothing this group does makes sense to me  stands for  the virus is directly linked to human behavior regarding animals  it has shown that  nature will always    the economy  coronavirususa climatechange environmentalawareness","Positif"
"695",0,"even all the ones with covid     coronavirususa","Netral"
"696",-5,"projections for april    usa  cases amp  dead   cases    dead  canada  cases amp  dead   cases    dead  ontario  cases   cases  covid coronavirus coronaviruspandemic coronavirususa","Negatif"
"697",0,"trump should be arrested for what he has caused   covid  trumpownseverydeath trumpisfakenews   coronaviruspandemic coronavirususa  trumpiskillingamericans trumpliesaboutcoronavirus  trumphasbloodonhishands trumpliesamericansdie  trumpisacompletefailure trumpmustgo","Netral"
"698",0,"anybody still protesting the stay at home order needs to see this heres a picture of the freezer truck theyre loading bodies of people who passed away from convid this is deadly serious stay inside covid coronavirususa ppe pandemic stayhome quarantine","Netral"
"699",1,"this is iran under the rule of islamist state of khamenei  iran tehran iranian masihi france germany us nyc coronavirususa irancoronavirus      vatican italy vaticano","Positif"
"700",1,"now which is the third world country covid coronavirususa","Positif"
"701",1,"seems like so many of the younger generation would love to have a new normal why is that i wonder   did their lives lack e coronavirususa","Positif"
"702",1,"need help making masks  covid  coronavirusuk  coronavirususa  free pdf instructions with pictures from my drive  leather mask template   blue towel mask template","Positif"
"703",1,"is this even legal covid coronavirususa coronaviruspandemic reopenamericanow","Positif"
"704",-3,"coronavirususa  author stephen king predicted a similar story of this pandemic in  when he released the book the stand amp made a miniseries for tv in  about a deadly flu virus released in a laboratory that caused worldwide deaths","Negatif"
"705",6,"trump supporters e he didnt say that and if he did he didnt mean it and if he did you didnt understand it and if you did its no big deal and if it is it we dont care and if you do go fuck yourself covid  coronavirususa  trumppressbriefing","Positif"
"706",-1,"coronavirus outbreaks have been reported in at least  us meat processing plants in  states  coronavirususa coronaviruscanada meatplants covid pandemic health meatpacking nurses physicians healthforall health vegan govegan healthcareworkers","Negatif"
"707",0,"if walmart can stay open then surely a small business can stay open coronavirususa","Netral"
"708",0,"the pentagon just released newly declassified footage of three ufos in step one of a new government initiative called yo i got thiswe gonna blame this shit on fckin aliens covid ufosighting coronavirususa quarantine","Netral"
"709",-1,"so jealous   has shorter haircut than i do now  coronavirususa","Negatif"
"710",1,"oh but trump is afraid hell miss a cheeseburger or welldone steak  bevegetarian meatpackingplants coronaviruspandemic coronavirususa socialdistancing coronavirusoubreak coronavirus covid covid","Positif"
"711",0,"california governor announces phase reopening plan   coronavirususa","Netral"
"712",1,"i know it hard to get another job but they should walk out  this isn good for the end user either tysonfoods covid coronavirususa coronavirus trumpisadangertothenation trumpisamassmurderer trumpisalaughingstock trumptheworstpresidentever","Positif"
"713",2,"if you need anything out the fridge you just ask your pandemic daddy me to      you are my pandemic daddy  coronavirususa covid","Positif"
"714",1,"a blessing is always around the corner coronavirususa","Positif"
"715",0,"why are you not celebrating that we hit the  million of coronavirususa cases let me guess we are amazing better leader the best in the entire world compare to other countries jodiomamao","Netral"
"716",-1,"yeah  whats up with the  sounds like s looking into it   tonight we get to hear what shes finding  coronavirususa meatplants meatpacking trumpliesamericansdie covid cdc","Negatif"
"717",0,"normal is never coming back  americans must remember who the tyrannical dictators in america were during the covid pandemic  covid coronavirus news politics covidusa coronavirususa unitedstates","Netral"
"718",0,"doesnt look like the situation is getting better to me either herd immunity will work or even more people will die covid coronavirususa trump donaldtrump trumppressbriefing trumppressconference trumppressconf covidiot covidus maga trumpvirus covidusa potus","Netral"
"719",4,"hair salons are going to be the high risk designated area once lockdown is lifted coronavirus coronavirususa","Positif"
"720",0,"a lot of people need to learn that opinions are not facts covid coronavirususa coronavirus facts opinion","Netral"
"721",0,"covid  has claimed more american lives than the vietnam war coronavirus coronavirususa","Netral"
"722",0,"netflix is making a comedy set in the coronavirus outbreak  coronavirususa coronaviruspandemic netflix comedy humor funny weneedtolaugh","Netral"
