"","score","text","klasifikasi"
"1",5,"healthcareheroes we love you thank you for all you do and are doing in this fight against coronavirususa your courageisbeautiful god bless you you are in our prayers","Positif"
"2",0,"when you can finally cook for your family and your kids put in their request then they say  mama im glad youre not sick anymore this my favorite lol covid coronavirususa covidsurvivor lovemyfamily","Netral"
"3",0,"in support of our healthcareheroes treating covid patients free group memberships entire course library  covid specific content form nursescovid covidfoam foamed medtwitter emergencymedicine firstresponders coronavirususa doctors nurses","Netral"
"4",1,"who is behind the coronavirus social distancing protests  coronavirususa coronaviruspandemic covid votehimout votebluetoendthisnightmare voteblue wakeupamerica wakeup","Positif"
"5",0,"coronavirususa  tonights stats","Netral"
"6",3,"i really cannot wait until everything goes back to normal though at the moment i can even remember what normal is momlife workingmom essentialworker mainelife coronavirususa","Positif"
"7",0,"susan rice kushners comment would be laughable if it werent deadly serious  via  covid coronavirus covidus coronaviruspandemic coronaviruslockdown coronavirususa coronavirusoutbreak","Netral"
"8",-1," they have schools in america some incredibly dumb people here usa howmanybodies covidusa coronavirususa trumpliesamericansdie","Negatif"
"9",1,"here is my connecticut covid update for wednesday april   please stay safe and healthy as we work together through this pandemic coronavirusct coronavirususa hopesandprayers","Positif"
"10",1,"i am really wishing i had a source of information about the pandemic i trusted and believe wait i do  coronavirususa allinillinois","Positif"
"11",0,"new news of coronavirus   covid coviduk coronavirususa usa ukraine chineseviruscorona","Netral"
"12",0,"i jus wanna do sum simple shit go to mall buy a pair jeans an get a pretzel coronavirususa","Netral"
"13",2," love how conservatives are alarmed at this but not the major public companies receiving massive bailout loans amp grants do y really think these ppl just want to stay home amp collect this is pathetic the gop bailout billionaires but cry foul on this coronavirususa","Positif"
"14",-1,"update coronavirususa  us  coronavirus deaths  more in the last  hours the  deaths in only a few months is more than all american deaths in the vietnam war","Negatif"
"15",6,"coronavirususa  trump reveals plans to bring back his  people rallies as he says he will travel to arizona and ohio says of the virus its going to leave  this is all to feed his ego and anyone who goes to one of these rallies is a fool","Positif"
"16",2,"beloved brooklyn teacher  dies of coronavirus after she was twice denied a covid test  abc news failure of leadership by the federal state and city governments another instance where your zip code determines your health outcome coronavirususa","Positif"
"17",-1,"so trumps  has dumped his shares of hydro and has bought shares in remdesivir instead  coronavirus  codvid  coronavirususa","Negatif"
"18",-3,"after another week matching within a few  of the prior weeks cases and italy doing the same thing i think conservatively were looking at k deaths in the us by end of may  coronavirususa coronavirus coronavirusupdate","Negatif"
"19",-3,"the patriots end game    trump congress politics news coronavirususa covidreliefirs covid covid lockdownend endtheshutdown rentrelief outerbanks nycoronavirus nyc nj pa ny fl flattenthecurve wwgwwga qanon quedateencasa","Negatif"
"20",-1,"no one is talking about the people in the cages peoplefirst coronavirususa","Negatif"
"21",0,"a genuine feel good track of the day  in  i started getting into electro breakdance hip hop then this little known funk track got me into soul  funk i have it on vinyl  rochelle  my magic man  covid covid coronavirusuk coronavirususa","Netral"
"22",-2,"perhaps heparin for blood clotting with covid covid coronavirususa coronavirus","Negatif"
"23",-1,"should rent be canceled because of the coronavirus s  look at issues with opinions from throughout the political spectrum  rentstrike coronavirususa","Negatif"
"24",-2,"fake good news cautious optimism is contagious just like a virus  trumpsthekingof wellnesswednesday coronavirususa pandemic pandumbic","Negatif"
"25",2,"talk is cheap coronavirususa might actually go away more quickly if trump took proactive measures to eradicate it such as using established scientific knowledge","Positif"
"26",0,"tribal governments were supposed to get  billion in emergency covid aid from the cares act more than a month later they still havent gotten any  via  coronavirus covid covidus coronavirususa coronavirusoutbreak coronalockdown","Netral"
"27",1,"big tech censors dissent over coronavirus lockdowns  its all a sham virushoax coronavirususa","Positif"
"28",-1,"a year in review  review covid coronavirusuk coronavirus coronavirususa wasfununtil  pandemic thisisshit socialdistanacing lockdown isolation","Negatif"
"29",-1,"if america is opening up again think we need to ban immigrationtourists from there for a while until they can prove they got this under control  god knows how long that will be  covid coronavirususa trump america stayhomesavelives","Negatif"
"30",-1,"deaths per million from the wuhan virus in us states districts and territories as of  edt on april  covid  sarscov coronavirus  coronavirususa  coronavirusoutbreak  wuhanvirus  ccpvirus","Negatif"
"31",1,"great to see  serving all communities during the coronavirususa pandemic    americaworkstogether","Positif"
"32",1,"and counting dead people due to your  incompetencies you are the epitome of entitlement high talking loser  coronavirus jaredkushnerforprison  trumpcoronavirustestfailure  trumpownseverydeath  kushnerownseverydeath  coronavirususa","Positif"
"33",4,"boris johnson also talked about successes  funnily when he resumed work his first call was to trump who also spouts this nonsense usa coronavirususa coronavirusuk","Positif"
"34",4,"coronavirususa  trumps thinking for what it is worth only a week ago that the death toll in the usa would be very low possibly as low as  has already gone up in smoke wish that it was otherwise and also for the words sake that he will be defeated come november","Positif"
"35",-2,"  truly alone and thats the most heartbreaking  around  residents died from coronavirus at  veterans home in massachusetts coronavirususa covid","Negatif"
"36",2,"earlier jets from the us navy  and the air force  flew over new york city to pay tribute to health workers fighting the coronavirus pandemic coronavirususa","Positif"
"37",0,"update coronavirususa  coronavirus cases  deaths globally   cases  deaths the united states has  of the worlds coronavirus cases","Netral"
"38",3,"basically it doesnt matter if you are endangered in your work environment or that you will die as a result of it they will cut your unemploymentbenefits coronavirus covid covid coronavirususa","Positif"
"39",-1,"the e antiviral drug remdisivir has reportedly generated positive data in tests run by the niaid to e its potential as a coronavirus treatment  compare reporting from   and   coronavirususa healthcare","Negatif"
"40",-1,"covid coronavirus coronaviruslockdownuk coronavirususa coronavirusbriefing coronavirus  deaths in america","Negatif"
"41",4,"please help a healthcare work  i struggling and could use any help i can get thank you ashleyrhollis cashapp cashappgiveaway bailouthumans bailouthumansnow healthcareheroes healthcareworkers covid coronavirususa healthworkers","Positif"
"42",-3,"coronavirus coronavirususa coronavirusupdate   based the absolutes closed cases where  recovered and  died i am gonna assume by those absolutes that survival in the united states is  almost  will die here are stats and states listed in order of most cases","Negatif"
"43",1,"warren aoc make coronavirus weapon stop business prosperity while americans are suffering  coronavirususa political","Positif"
"44",0,"breaking good news coronavirus us top infectious disease doctor says drug trial shows quite good news coronavirus  coronavirus coronaviruspandemic coronavirususa coronavirusupdates covid covid covid covid","Netral"
"45",-4,"americans were killed in the vietnam war over a period of  years more than  americans have been killed by covid since january of this year  its not a hoax  its not a democratic conspiracy its not a ploy to oust trump  coronavirususa","Negatif"
"46",2,"the chelsea collaborative is whats happening  im in awe of the amazing work theyre doing to save lives and keep our city healthy     staysafe covid fooddelivery community communityservice prayer covid coronavirususa","Positif"
"47",-1,"really get your head out of your ass with over  deaths this government did not respond fakenews covid worstpresidentinhistory coronavirususa coronavirusupdate","Negatif"
"48",3,"lol let him panic hes quite old anyway americans worried about food and keeping a roof over their heads is more important if thats socialism then so be it the government propping up corporations is socialism coronavirususa","Positif"
"49",5,"im not sure trump understands what a virus is i would love to hear him describe it as simply as he can that would be fun coronavirususa","Positif"
"50",0,"coronavirususa  one that was carried largely on the lips of medical professionals who have no business running a national economy or government","Netral"
"51",1,"cnn reporter on jared kushners victory lap i dont know what hes talk  via  pathetic covid coronavirus covidus coronaviruspandemic coronaviruslockdown coronavirususa coronavirusoutbreak","Positif"
"52",-2,"coronavirususa in fact covid hype will go down as one of the political world biggest most shamefully overblown overhyped overly and irrationally inflated and outright deceptively flawed responses to a health matter in american history","Negatif"
"53",1,"im just going to pin this because it hasnt changed does everyone understands this visual us consistently has  of all cases in the world coronavirus covid coronavirususa trumpliesamericansdie","Positif"
"54",3,"honestly suzanne collins is living her best life rn a new bookmovie in the works and a hunger gamesstyle rebellion hitting the usa so who gonna be our mockingjay pandemic coronavirususa hungergames","Positif"
"55",0,"central park west a typically bustling stretch on manhattan upper westside in new york during peak hour today coronavirususa","Netral"
"56",0,"coronavirus death toll in us likely worse than numbers say  coronavirususa coronaviruspandemic covid votehimout votebluetoendthisnightmare voteblue wakeupamerica wakeup","Netral"
"57",2,"fema orders  new body bags as us covid death toll e  report    coronavirususa","Positif"
"58",3,"trump i didn say it he did and here is the tape  via  trump donthecon trumplies pathetic covid coronavirus covidus coronaviruspandemic coronaviruslockdown coronavirususa coronavirusoutbreak","Positif"
"59",0,"central park west a typically bustling stretch on manhattan upper westside in new york during peak hour today  coronavirususa","Netral"
"60",2,"fema orders  new body bags as us covid death toll e    coronavirususa","Positif"
"61",-1,"nothing to see here folks just an unusual amount of deaths in relation to the last few years  a   maga trump trumplandslide kag kag coronavirus covidus coronavirusoutbreak covid covidusa covid coronavirususa","Negatif"
"62",2,"is my favorite essentialworker essentialworkersday thankyou coronavirususa covidpandemic","Positif"
"63",0,"don destroy people lives and livelihoods  coronavirususa","Netral"
"64",-2,"one in four americans depend on trump as major source of covid news  poll   coronavirususa","Negatif"
"65",1,"how accurate is us covid death count   coronavirususa","Positif"
"66",-2,"worst economy in a decade what ne  in our lifetime coronavirususa trumpinaction  realdonaldtrump trump","Negatif"
"67",2,"the white house gift shop is selling coronavirus commemorative coins now coronavirususa wuhancoronavirus","Positif"
"68",0,"ventilators gt testing gt masks which direction will the herd be stampeded ne  perpetualcrisis mediamanipulation madnessofcrowds coronalockdown coronavirususa coronavirus","Netral"
"69",-1,"they will let you drown in your pool of facts hence the name  left   antibodies backtowork coronavirususa","Negatif"
"70",-3,"k americans have died surpassing the amount of  us troops that died in the vietnam war   but what do coronavirus and the vietnam war have in common   did nothing to fight either of them   coronavirus covid coronavirususa coronavirusoutbreak covid","Negatif"
"71",0,"coronavirus coronavirususa sarscov covid covidusa   time to reopen the economy ","Netral"
"72",1,"here are the ct dept of public health covid stats for wednesday april     please stay safe and healthy as we work together through this pandemic coronavirusct coronavirususa hopesandprayers","Positif"
"73",1,"covid risk e   covid covid levellockdown dlaminizuma coronavirus coronavirusuk coronavirusinindia coronavirusinnigeria coronavirusde coronavirususa endthelockdown covidusa covidaus covid covidcanada stayhomesavelives","Positif"
"74",0,"wow incredibly heartbreaking coronavirususa","Netral"
"75",-1,"a disinfo campaign by the fakenewsmedia and partisan driven regulations by democratic politicians has prevented for many the use of a valuable tool against the coronavirus   great study from italy on hydro  coronavirususa kag twgrp","Negatif"
"76",0,"which country has the highest coronavirus death toll  watch the bar chart race here    coronavirus death covid covid corona lockdown covid data coronavirususa usa spain coronavirusindia wednesdaymorning wednesdaymood wednesdaythoughts","Netral"
"77",0,"which country has the highest coronavirus death toll  watch the bar chart race here    coronavirus death covid covid corona lockdown covid data coronavirususa usa spain coronavirusindia wednesdaymorning wednesdaymood wednesdaythoughts","Netral"
"78",0,"b nih initiative seeks to make covid diagnostics available to all americans by end of summer  coronavirustests covidtesting covid covid covidusa coronavirustesting covid covidus coronavirususa coronavirus covid","Netral"
"79",2,"the kangaroo crew  stay safe prek homeschool socialdistancing  health  kids mom dad homebound nj freeresources fun literacy games story  coronavirususa cnnsesamestreet masks alphabet","Positif"
"80",2,"now hes seeking to profit from all this death amp suffering is there no depth he wont sink to people are sick amp dying amp this white house gift shop is selling this crap coronavirususa votehimout votebluetoendthisnightmare voteblue wakeupamerica wakeup","Positif"
"81",-1,"update maryland begins universal covid testing for all nursing homes  governor  sputnikupdates coronavirususa","Negatif"
"82",0,"coronavirus coronavirususa drtedros  ccp xi jingping and who did this","Netral"
"83",-1," phantom plague evangelicals who defied socialdistancing guidelines are dying of coronavirus in frightening numbers  usa fakechristians trumpsupporters idiots coronavirusupdates coronavirususa covid","Negatif"
"84",-3,"and didnt  say all the tests needed were on their way they lie they lie      wherearethetests  coronavirususa","Negatif"
"85",4," wanna go back to where it was that where we going to be look this thing will pass we done a very good job and we now on the other side  donald trump  apr   trumpisanidiot  coronavirususa ","Positif"
"86",0,"top us doctor new remdesivir data shows  cut in covid recovery  coronavirususa","Netral"
"87",-1,"icymi  donates jet fuel to  and  for coronavirus relief efforts via   oott oilandgas bp coronavirususa","Negatif"
"88",0,"nurses to antilockdown activists my lifes on the line go home   stayathome coronavirususa pandemicresponse publichealth","Netral"
"89",1,"sen tammy duckworth says trump values tv ratings over health of west point cadets  coronavirususa coronaviruspandemic westpointcadets westpoint  healthrisk votehimout votebluetoendthisnightmare voteblue wakeupamerica","Positif"
"90",-1,"in view of the continuing coronavirususa and covid we are canceling the may  testing session be safe and stay healthy","Negatif"
"91",0,"america during global lockdown memes coronavirus coronavirususa usa","Netral"
"92",0,"hoping for the best   coronavirus coronavirususa covid","Netral"
"93",0,"governor ron desantis speaks breakingnewsnow breakingnews breakingnews breakingnewz breakingnow breaking florida fla fl coronavirus covid coronaviruspandemic covidpandemic coronavirusus covidus coronavirususa covidusa pandemic","Netral"
"94",4,"millions of americans are still afraid to leave their houses but the white house is talking about it in the past tense as if the movie is over and for the low low price of only  on sale for  if you act now you can even get a commemorative coin set  coronavirususa","Positif"
"95",-3,"im guessing no one in this family has had or died from the coronavirus because what in thee entire is there to celebrate about this global pandemic you sick mofos simple minded azzhats  always always always about the money for these chitstains on society  coronavirususa","Negatif"
"96",1,"hey let define what age someone ceases to be valuable coronavirususa wtf","Positif"
"97",0,"billgates  april  be ready for pandemic       coronavirus covid coronaviruspandemic covid covid vaccination pandemic coronavirususa stayathome nwo health pandemia populationreduction","Netral"
"98",-1,"latest update on the coronaviruspandemic i didn think there could be a more basket case response to the coronavirus than the usa then brazil comes along  months into this and there are still countries in denial covid covid coronavirusuk coronavirususa covid","Negatif"
"99",-1,"african americans account for  of georgia coronavirus hospitalizations coronavirusupdate coronavirususa t","Negatif"
"100",1,"try to get your head around this projection by  while also remembering that he deleted this tweet  covid coronavirus democrats liars corruption coronavirususa","Positif"
"101",1,"coronavirusuk coronavirususa ripirrfankhan i dont normally do the pope but this is spot on","Positif"
"102",1,"  the official death toll in the usa is now over     coronaviruspandemic coronavirus  covidpandemic   covid  covidusa  coronavirususa","Positif"
"103",0,"florida ordered coroners to stop releasing coronavirus death totals  coronavirusupdate  coronavirususa","Netral"
"104",0,"coronavirus coronavirususa openamericanow usa things that make you go hmmmcovid drug researchedtestedapproved super fastpossibly already tested amp just waiting for right time to release as treatment","Netral"
"105",0," thread     coronavirus  covid  coronavirususa  pandemic","Netral"
"106",0," thread   youtube ceo susan wojcicki warns anything that goes against who will be removed from youtube   coronavirus  covid  coronavirususa  pandemic","Netral"
"107",-1," thread   covid press conference with dr dan erickson and dr artin massihi of accelerated urgent care in bakersfield california   coronavirus  covid  coronavirususa  pandemic","Negatif"
"108",2," thread   can you find this video   coronavirus  covid  coronavirususa  pandemic","Positif"
"109",0,"uh huh right the trump troupe including you    know nothing amp are pushing the us to deeper coronavirususa  disaster iceberg what iceberg","Netral"
"110",-2,"dear mrpresident if i remember well your prediction back in early april was kdeaths for coronavirususa not before july bad prediction once again today   god saves ","Negatif"
"111",0,"us positivedeaths over  positive  covidus coronavirususa coronavirus coronavirusupdateusa usacoronavirus usalockdown coronavirusupdates coronavirusupdate usavirus covid covid newyorktimes newyorkstateofmind covidusa coronaviruspandemic","Netral"
"112",-1,"trump yesmen knownothings now running  along with     amp others has left us govt weak amp struggling        coronavirususa     via","Negatif"
"113",-1,"the difference between flights above eu and us is staggering here i look into the reason why and ask if it is a major factor in the spread of covid in us which has now passed a million cases of coronavirus coronavirususa f","Negatif"
"114",1,"the rising number of homeless people in minnesota is worrying with the outbreak of the coronavirus in the united states and trump administration is still doing poorly coronavirus coronavirususa","Positif"
"115",0,"covid  coronavirus coronavirususa   join us thegreatawakening","Netral"
"116",-1,"with the us economy shutting down to deal with the outbreak of the coronavirus the countrys economic situation is sounding the alarm coronavirus covid coronavirususa","Negatif"
"117",2,"i suppose some twitter arguments require more than a few tweets free america covid coronavirus coronavirustruth coronavirususa freeamericanow openupamerica","Positif"
"118",-3,"wow i would be devastated if my  year old grandmother died of covid  or for any reason thankfully she is healthy and not in a nursing home the thoughtlessness of these asshats is astounding coronavirususa covid","Negatif"
"119",1,"the fight against corona requires a great deal of social trust but we do not see it in the united states coronavirus coronavirususa","Positif"
"120",0,"while the corona virus kills people in new york city hart island hosts new dead coronavirus covid coronavirususa","Netral"
"121",-3,"those guys will sell anything including selling out america and us the poor victims of coronavirususa  gtgtgt covidiots and they still luv him like roberto duran would say no mask","Negatif"
"122",-1,"these are confirmed deaths there are likely thousands more but we aren able to sufficiently test in order to arrive at an accurate number coronavirususa covid","Negatif"
"123",0,"breaking us crosses  deaths coronavirususa","Netral"
"124",0,"mass update   cases and  deaths  cases in bristol county where i live   new deaths  coronavirususa coronavirus coronavirusupdate coronavirusmassachusetts","Netral"
"125",1,"current  day rolling average of covid testing per capita per  people coronavirususa   us seems to be comparing well","Positif"
"126",2,"this is how we know what love is jesus christ laid down his love for us niv bible  john   coronavirusus coronavirususa covidus covidusa covidus covidusa","Positif"
"127",1,"trump says he wont e social distancing guidelines  coronavirususa coronaviruspandemic covid openingtoosoon stayhome washyourhands votehimout votebluetoendthisnightmare voteblue wakeupamerica wakeup","Positif"
"128",1,"breaking  us covid death toll surpasses   johns hopkins university   sputnikbreaking  coronavirususa","Positif"
"129",5,"how to keep makeup and tools clean amid the pandemic   life live beauty health fitness usa jobs free makeup family leadership success science covid model girl coronavirususa home wednesdaywisdom wednesdaythoughts wednesdaymotivation","Positif"
"130",0,"italy is performing twice as many tests per dayper capita followed by spain losing coronavirus coronavirususa","Netral"
"131",2,"so basically any big plant is in trouble coronavirus covidus coronavirusoutbreak covid covid covidusa covid coronaviruspandemic coronavirususa socialdistancing stayathome stayhome ccpvirus","Positif"
"132",1,"you trumpy  are  a complete failure amp you  trump are on your way out of power  before may st you trump own the coronavirususa amp the over  cases amp over  deaths biggly  as your spawn jr  likes to say  resignnowtrump","Positif"
"133",0,"senior chinese official challenges trump over coronavirus response says us wasted weeks  coronavirususa coronaviruspandemic covid trumpliedpeopledied votehimout votebluetoendthisnightmare voteblue wakeupamerica wakeup","Netral"
"134",0,"coronavirususa reported deaths now e","Netral"
"135",-2,"i have no polite words for this          trump kag coronavirus  kag coronaviruspandemic  coronavirusoutbreak covid covidusa covid coronavirususa","Negatif"
"136",0,"making the best out of quarantine give her a listen to brighten your day  coronavirususa quarantinelife covid","Netral"
"137",4,"ive posted my ne cobioart coloring pages this time we learn a little bit about the mantisshrimp im still happy to take requests so let me know if there is anything you want to learn more aboutcolor    stayhome coronavirususa homeschooling","Positif"
"138",1,"fda to authorize emergency use of new coronavirus treatment  coronavirususa coronaviruspandemic covid stayhome washyourhands votehimout votebluetoendthisnightmare wakeupamerica","Positif"
"139",-3,"last night    messy hair  drinking wine directly out of the bottle  dancing to cant touch this in the kitchen  ne quarantine level unlocked   covid  coronavirususa  quarantinelife","Negatif"
"140",-4,"billdeblasio breaks up crowded  funeral in brooklyn now faces criticism for singling out jewishcommunity covid coronavirususa","Negatif"
"141",0,"united states world coronavirus covid cases statistics   united states coronavirus cases deaths recovered  covidusa coronavirususa covidusa unitedstatesofamerica usacoronavirus  source worldometers","Netral"
"142",1,"infected people really shows the failure of trumps presidency      coronavirususa","Positif"
"143",1,"te already seeing close to  new cases of the plague today just a couple days after reopening as alluded to yesterday will be interesting to see how the red gop control group states georgia florida and te perform over the ne few days and weeks coronavirususa","Positif"
"144",1,"so  treats ground hogs better than he treats the jews of newyorkcity  coronavirusnyc coronavirus coronavirususa wednesdaymotivation","Positif"
